{
  "schema_version": "0.1",
  "created_at": "2026-07-15T16:30:00+09:00",
  "reviewer": "braveji",
  "owner": "sjpark",
  "experiment": {
    "experiment_id": "er_status_clam_uni_v2",
    "task": "er_status",
    "endpoint": "ER IHC binary classification (positive / negative)",
    "commit_hash": "0e0a1e1f8f02d472e65728a25701c57f4ac48462",
    "config_path": "experiments/sjpark/er_status_clam_uni_v2/config.yaml",
    "metrics_path": "experiments/sjpark/er_status_clam_uni_v2/metrics.json",
    "predictions_path": "experiments/sjpark/er_status_clam_uni_v2/predictions.npy",
    "embedding_manifest_path": "/workspace/data/cache/biop02/embedding_manifest_uni.csv",
    "split_policy_path": "agents/data/split_policy_v0.md"
  },
  "checks": {
    "data_leakage": {
      "status": "caution",
      "evidence": [
        "split_policy_v0.md LOCKED 2026-07-13 (kkkim sign-off 2026-07-11, braveji cross-sign 2026-07-13) — split_hash=5995f29d3978b831, metrics.json stamping 완료",
        "patient-overlap assert 로그 미제출 (train∩val case_id 수동 확인 불가 — sjpark 미이행)",
        "site_classifier_probe UNI AUC = 0.9977 (CI 0.9958–0.9989) — UNI 임베딩이 수집 사이트를 거의 완벽하게 구분함. checklist #1 reject 기준(≥0.75) 초과",
        "site-disjoint split 의도는 split_policy_v0.md에 명시 (16/10/11 사이트 분배, 해시 검증)",
        "실제 CLAM 학습에 site-disjoint split이 적용됐는지 config/log 확인 미완료 (sjpark 미이행)"
      ],
      "notes": "split lock + Critic cross-sign 완료(2026-07-13). 잔여 caution 2건: (1) patient-overlap assert 로그 미제출, (2) CLAM 학습 config의 site-disjoint 적용 명시 미완료. site_confound AUC 0.9977은 심각하나 CPTAC ext AUC 0.894가 site leakage 크지 않음을 간접 지지. pass 조건: sjpark patient-overlap 로그 + site-disjoint config 명시."
    },
    "baseline_comparison": {
      "status": "caution",
      "evidence": [
        "CLAM-SB val AUC 0.9013 (95% CI 0.8371–0.9539)",
        "random AUC 0.5262 → CLAM +0.375 (명확한 우위)",
        "mean_embed AUC 0.8162 (CI 0.7429–0.8852) → CLAM +0.0851 (diff ≥ 0.03 충족)",
        "CI 중첩 확인: CLAM lower 0.8371 < mean_embed upper 0.8852 → CI 중첩 존재 (checklist AND 조건 미충족)",
        "MLP 대비 CLAM 개선: 0.8209 → 0.9013 (+0.0804), AUPRC 0.9295 → 0.9632 — Attention MIL이 유의미하게 우수함",
        "subtype_only(PAM50 기반) AUC 0.9181 (CI 0.8767–0.9553) vs CLAM 0.9013: paired test p=0.613, diff CI [-0.088, 0.045] → 통계적 차이 없음 (tied with molecular baseline)",
        "CLAM vs mean_embed paired significance 파일 부재 — 판정이 CI 중첩(비-paired)에 의존. paired_significance*.json은 subtype_only(ceiling) 대비만 존재. PAM50 4-class엔 mean_embed 대비 paired(CI 0 제외)가 있어 #2 pass 근거가 됐으나, ER/PR/HER2엔 없음(braveji 재판정 2026-07-15, BIOP02-50 comment 11172).",
        "[kkkim 정식 peer review 완료, 커밋 5ae1404 · BIOP02-50 comment 11174] 지정 리뷰어 kkkim(non-owner)이 baseline JSON에서 CLAM vs mean_embed CI를 독립 재계산 → ER/PR/HER2 모두 CI 중첩(CLAM이 trivial baseline 유의 상회 못함) 확인. braveji 재판정과 독립적으로 동일 결론 = 2인 교차 확인. Owner≠Reviewer 게이트 해소."
      ],
      "notes": "checklist 기준(diff≥0.03 AND CI 비중첩) 중 diff 조건은 충족하나 CI 중첩으로 caution. 중요: CPTAC 외부 검증에서 subtype_only(PAM50 0.9615) vs CLAM(0.894): diff=-0.067, CI[-0.094,-0.042], p≈0 — 유의하게 역전. TCGA 내부(p=0.613, not significant)와 외부(p≈0)가 정반대 결론. sjpark self-critic: TCGA 내부 성능이 site/batch 특유 subtype 상관 아티팩트를 학습했을 가능성 시사(site_confound AUC 0.9977과 연관). subtype_only는 분자 데이터로 H&E와 직접 비교 부당하나, 내부↔외부 역전 자체가 CLAM 일반화의 한계를 드러냄. [갱신 2026-07-15] kkkim peer review로 #2 결론이 2인 독립 확인됨 — CI 중첩 폭이 커 paired bootstrap으로도 뒤집힐 가능성은 사실상 없다. sjpark의 mean_embed paired sig는 결론 확정용이 아니라 형식 근거 문서화이며, #2의 과학적 결론('MIL 부가가치 mean_embed 대비 유의하지 않음')은 확정적. pass의 실질 게이트는 jhans #5."
    },
    "counterfactual_check": {
      "status": "caution",
      "evidence": [
        "attention ablation: auc_full 0.9013 → auc_top_removed 0.9004 → AUC-level drop = 0.0009 (극히 미미)",
        "proba-level: mean_abs_proba_delta_top 0.0564 vs random 0.0028 (~20배) — top attention 패치가 예측에 영향을 줌",
        "label shuffle AUC = 0.5847 (random ✓ — 실제 라벨 신호에 의한 학습 확인됨, 2026-07-13)"
      ],
      "notes": "label shuffle AUC 0.5847로 data leakage 아님 확인. AUC-level faithfulness 0.0009는 극히 미미하나, proba-level 20배 차이는 top attention이 실질적으로 예측에 기여함을 지지. MIL aggregation 특성상 AUC는 일부 패치 제거에 robust. 전체 counterfactual 판정: caution (AUC-level 약함, per-patch 해석 보강 권고)."
    },
    "cross_dataset_check": {
      "status": "pass",
      "evidence": [
        "CPTAC-BRCA 외부 검증 AUC 0.894 (CI 0.8612–0.9263), n_test=387",
        "CPTAC AUC 0.894 vs val AUC 0.9013: 절대 성능 차이 0.007 → 일반화 손실 최소",
        "단, CPTAC에서 subtype_only(PAM50) AUC 0.9615 — CLAM 대비 +0.067, p≈0, CI[-0.094,-0.042] → 유의한 역전",
        "TCGA val: CLAM vs subtype_only p=0.613(tied) → CPTAC ext: p≈0(역전) — 내외부 불일치",
        "라벨 출처: official (BIOP02-55, cBioPortal brca_cptac_2020) — jamie 공식 라벨 확인됨",
        "CPTAC는 학습/튜닝에 전혀 사용되지 않은 진정한 external hold-out"
      ],
      "notes": "Paper A 범위에서 #4는 DepMap/GDSC 전이 체크(Paper B)로 정의되나, CPTAC 외부 검증을 cross-dataset 항목으로 포함하여 평가. AUC 0.894는 Paper A 핵심 결과이며 pass 판정."
    },
    "biological_plausibility": {
      "status": "pass",
      "evidence": [
        "ER 상태는 H&E 형태와 연관 — Couture 2018 (npj BC), Kather 2020 등 선례",
        "Attention MIL이 ER+ 관련 핵 형태(낮은 등급, 작은 핵)에 집중할 가능성 생물학적으로 타당",
        "ICI/Pembrolizumab 추천 없음, 약물 전이 없음"
      ],
      "notes": "생물학적으로 타당. sub-check: jhans (non-owner)."
    },
    "drp_framing": {
      "status": "pass",
      "evidence": [
        "task: 'er_status' (표현형 예측)",
        "metrics.json/config.yaml에 금지 표현 미발견",
        "claim_level: 'hypothesis_only'"
      ],
      "notes": "DRP 프레이밍 없음."
    },
    "claim_level": {
      "status": "pass",
      "evidence": [
        "claim_level: hypothesis_only 명시",
        "val + CPTAC external 결과로 구성, 치료 권고 없음",
        "commit_hash 기록됨 (0e0a1e1)"
      ],
      "notes": "claim 수준 적절."
    }
  },
  "critic_status": "caution",
  "claim_level": "hypothesis_only",
  "summary": "ER CLAM-SB(UNI v2) val AUC 0.9013, CPTAC 0.894. MLP 대비 크게 개선. 그러나 CPTAC 외부에서 subtype_only(0.9615) vs CLAM(0.894) p≈0로 유의 역전 — TCGA val에서 tied(p=0.61)였던 결과와 정반대. site_confound 0.9977과 결합하면 CLAM이 사이트 아티팩트 기반 subtype 상관을 부분적으로 학습했을 가능성 있음. split lock + label shuffle + site-disjoint 적용 확인 필요. 전체 판정: caution (이전보다 이슈 심각도 높음).",
  "required_followups": [
    "[sjpark] patient-overlap assert 로그 제출 (train∩val case_id == 0) — 미이행",
    "[sjpark] CLAM 학습 config에 site-disjoint split 적용 여부 명시 (per_site split 또는 GroupKFold 확인) — 미이행",
    "[sjpark] CLAM vs mean_embed paired significance를 ER/PR/HER2 내부·외부에 산출 — 현재 subtype_only 대비 paired만 존재. CI 중첩 판정을 paired p-value로 확정. PAM50 4-class(paired_significance_external.json)와 동일 방식. #2 판정의 직접 근거.",
    "[Done 2026-07-13] split_policy_v0 LOCKED (kkkim sign-off 2026-07-11, braveji cross-sign 2026-07-13, split_hash=5995f29d3978b831)",
    "[Done 2026-07-13] label shuffle AUC 0.5847 확인 (random ✓)"
  ]
}
