{
  "schema_version": "0.1",
  "created_at": "2026-07-15T16:30:00+09:00",
  "reviewer": "braveji",
  "owner": "sjpark",
  "experiment": {
    "experiment_id": "her2_status_clam_uni_v2",
    "task": "her2_status",
    "endpoint": "HER2 IHC binary classification (positive / negative; equivocal 251장 제외)",
    "commit_hash": "0e0a1e1f8f02d472e65728a25701c57f4ac48462",
    "config_path": "experiments/sjpark/her2_status_clam_uni_v2/config.yaml",
    "metrics_path": "experiments/sjpark/her2_status_clam_uni_v2/metrics.json",
    "predictions_path": "experiments/sjpark/her2_status_clam_uni_v2/predictions.npy",
    "embedding_manifest_path": "/workspace/data/cache/biop02/embedding_manifest_uni.csv",
    "split_policy_path": "agents/data/split_policy_v0.md"
  },
  "checks": {
    "data_leakage": {
      "status": "caution",
      "evidence": [
        "split_policy_v0.md LOCKED 2026-07-13 (split_hash=5995f29d3978b831, kkkim sign-off 2026-07-11, braveji cross-sign 2026-07-13)",
        "patient-overlap assert 로그 미제출 (sjpark 미이행)",
        "n_train=496 (equivocal 251장 제외) — equivocal 제외 기준이 split 이전/이후 적용 여부 여전히 불명확",
        "site_confound AUC 0.9977 — site-disjoint split config 명시 미완료 (sjpark)"
      ],
      "notes": "split lock 완료(2026-07-13). HER2 특유 추가 이슈: equivocal 케이스 제외 순서 확인 필요(sjpark). 그러나 reject 결론에는 영향 없음 — 두 코호트 모두 random 수준(val CI 0.5 포함, ext AUC 0.530)."
    },
    "baseline_comparison": {
      "status": "reject",
      "evidence": [
        "HER2 CLAM-SB val AUC 0.5992 (95% CI 0.483–0.7106) — CI가 0.5를 포함 → random과 통계적으로 구별 불가",
        "random AUC 0.4797 (CI 0.374–0.599) — 모델 CI와 중첩이 큼",
        "mean_embed AUC 0.5477 (CI 0.431–0.660) — 모델 CI [0.483–0.711]와 대부분 중첩",
        "subtype_only(PAM50) AUC 0.724 (CI 0.620–0.824) >> 모델 0.5992 — 큰 격차",
        "CPTAC 외부 검증 AUC 0.5297 (CI 0.440–0.619) — CI에 0.5 포함. 외부에서 완전히 random 수준",
        "CPTAC AUPRC 0.1213 — 외부 코호트에서 사실상 붕괴",
        "MLP → CLAM 개선: 0.5509 → 0.5992 (+0.048) — 개선 있으나 여전히 random 영역",
        "best_val_loss = 0.666 ≈ binary cross-entropy 이론 상한 → 모델 학습 실패에 가까움",
        "CLAM vs mean_embed paired significance 파일 부재 — 판정이 CI 중첩(비-paired)에 의존. paired_significance*.json은 subtype_only(ceiling) 대비만 존재. PAM50 4-class엔 mean_embed 대비 paired(CI 0 제외)가 있어 #2 pass 근거가 됐으나, ER/PR/HER2엔 없음 (braveji 재판정 2026-07-15, BIOP02-50 comment 11172).",
        "[kkkim 정식 peer review 완료, 커밋 5ae1404 · BIOP02-50 comment 11174] 지정 리뷰어 kkkim(non-owner)이 baseline JSON에서 CLAM vs mean_embed CI를 독립 재계산 → ER/PR/HER2 모두 CI 중첩(CLAM이 trivial baseline 유의 상회 못함) 확인. braveji 재판정과 독립적으로 동일 결론 = 2인 교차 확인. Owner≠Reviewer 게이트 해소."
      ],
      "notes": "HER2 CLAM AUC 95% CI가 0.5를 포함하며 외부 검증(CPTAC ext AUC 0.530)이 random 수준. H&E 형태학으로 HER2 유전자 증폭을 예측하는 것은 본질적으로 어렵다는 선행 연구(Kather 2020, Lu 2021)와 일치하는 과학적으로 예상된 음성 결과. checklist 기준 → reject. [갱신 2026-07-15] kkkim peer review로 #2 결론이 2인 독립 확인됨 — CI 중첩 폭이 커 paired bootstrap으로도 뒤집힐 가능성은 사실상 없다. sjpark의 mean_embed paired sig는 결론 확정용이 아니라 형식 근거 문서화이며, #2의 과학적 결론('MIL 부가가치 mean_embed 대비 유의하지 않음')은 확정적. pass의 실질 게이트는 jhans #5."
    },
    "counterfactual_check": {
      "status": "caution",
      "evidence": [
        "attention ablation: auc_full 0.5992 → auc_top_removed 0.5935 → drop 0.0057",
        "auc_drop_random = -0.0021 (random 제거 시 오히려 소폭 상승)",
        "proba-level: mean_abs_proba_delta_top 0.0284 vs random 0.0028 (~10배)",
        "ER/PR(~20배) 대비 낮은 proba faithfulness",
        "label shuffle AUC = 0.4829 (random ✓ — 2026-07-13)"
      ],
      "notes": "label shuffle AUC 0.4829 확인(random ✓ — 데이터 누수 아님). AUC가 random 수준이므로 counterfactual 실질적 의미 없음. reject 결론에 영향 없음. HER2 음성 결과가 핵심 발견."
    },
    "cross_dataset_check": {
      "status": "reject",
      "evidence": [
        "CPTAC 외부 검증 AUC 0.5297 (CI 0.440–0.619) — CI에 0.5 포함 → random 수준",
        "CPTAC balanced_acc 0.5 — 완전 random",
        "CPTAC AUPRC 0.1213 — 극히 낮음 (클래스 불균형 고려해도 random 이하)"
      ],
      "notes": "외부 검증에서도 random 수준 확인 — HER2 음성 결과가 CPTAC 코호트에서도 재현됨. 이는 TCGA 과적합이 아닌 태스크 고유의 어려움을 확인하는 중요한 결과."
    },
    "biological_plausibility": {
      "status": "pass",
      "evidence": [
        "HER2 증폭은 유전자/단백질 수준 이벤트 — H&E 형태학에서 직접 관찰 어려움 (Kather 2020)",
        "equivocal 케이스 제외로 클래스 불균형 심화",
        "CLAM Attention MIL도 HER2 예측 개선에 제한적 — 음성 결과는 과학적으로 타당",
        "3-way 비교에서도 EXAONE_sg 최고 AUC = 0.697 (여전히 moderate)",
        "ICI/Pembrolizumab 추천 없음"
      ],
      "notes": "이 결과는 실험 실패가 아닌 과학적으로 예상된 음성 결과(expected negative result). Paper A Limitation 섹션에서 정직하게 기술해야 함."
    },
    "drp_framing": {
      "status": "pass",
      "evidence": [
        "task: 'her2_status' (표현형 예측)",
        "금지 표현 미발견",
        "claim_level: 'hypothesis_only'"
      ],
      "notes": "DRP 프레이밍 없음."
    },
    "claim_level": {
      "status": "pass",
      "evidence": [
        "claim_level: hypothesis_only 명시",
        "metrics.json에 음성 결과 정직하게 기술",
        "commit_hash 기록됨 (0e0a1e1)"
      ],
      "notes": "음성 결과를 과장 없이 기술. Paper A에서 HER2 예측 한계를 '태스크 고유 한계'로 표현 권고."
    }
  },
  "critic_status": "reject",
  "claim_level": "hypothesis_only",
  "summary": "HER2 CLAM-SB(UNI v2) val AUC 0.5992 (CI 0.48–0.71), CPTAC ext AUC 0.5297 — 두 코호트 모두 random 수준. CI가 0.5를 포함하며 CPTAC에서도 random 재확인. baseline_comparison reject + cross_dataset_check reject → 전체 critic_status: reject. 이전 MLP 리뷰(BIOP02-50 reject)와 동일한 결론을 CLAM에서도 확인. 이 결과는 #biop02-experiments 공유 불가이나 Paper A Limitation에 반드시 기술해야 함. EXAONE_sg 재실험 권고.",
  "required_followups": [
    "[sjpark] equivocal 케이스 제외 순서 확인 (split 이전/이후) — 미이행",
    "[sjpark/kkkim] HER2 equivocal 처리 전략 재논의 (제외 유지 vs 3-class 분류)",
    "[sjpark] EXAONE_sg 임베딩으로 HER2 재실험 (3-way 비교에서 EXAONE_sg HER2 AUC 0.697로 최고)",
    "[braveji] Paper A Limitation에 HER2 음성 결과 및 H&E 한계 기술",
    "[sjpark] CLAM vs mean_embed paired significance를 ER/PR/HER2 내부·외부에 산출 — 현재 subtype_only 대비 paired만 존재. CI 중첩 판정을 paired p-value로 확정. PAM50 4-class(paired_significance_external.json)와 동일 방식. #2 판정의 직접 근거.",
    "[Done 2026-07-13] split_policy_v0 LOCKED (split_hash=5995f29d3978b831)",
    "[Done 2026-07-13] label shuffle AUC 0.4829 (random ✓)"
  ]
}
